{
  "assessment": "passed_declared_checks",
  "audit_plan_ref": "ra-plan-f5827e8808cba1802b8f4dd0f75f6d15",
  "audit_readiness": "review_required",
  "audit_result_id": "ra-result-dbaf513e89f215e68f6ecb5609900a5d",
  "baseline_request_ref": "tsd-request-0123456789abcdef",
  "causal_language_allowed": true,
  "check_result_refs": [
    "ra-check-result-aefe133ab8ab219aa743072ab64e9e29",
    "ra-check-result-fa25feef556401371c628a99603372b2",
    "ra-check-result-eddfa2a47adcd4e77e892fe16a737252",
    "ra-check-result-a1494d3d3171a848b470b2bbeb6c361b",
    "ra-check-result-a17a6680c3b3050ff68d6d900c8f9faf"
  ],
  "claim_eligibility": "causal_candidate",
  "completed_required_check_count": 5,
  "execution_status": "success",
  "plan_timing": "post_result_exploratory",
  "release_recommendation": "review_required",
  "required_check_count": 5,
  "schema_version": "0.1.0",
  "warnings": [
    "post-result audit is exploratory"
  ]
}
